{
  "schemaVersion": 1,
  "journeyKey": "gj-2",
  "worldRef": { "worldKey": "world-v1", "worldVersion": "1.0.0" },
  "actorSet": [
    { "participantId": "syn-guardian-ada", "actorRole": "guardian" },
    { "participantId": "syn-caregiver-cara", "actorRole": "caregiver" },
    { "participantId": "syn-caregiver-dana", "actorRole": "lead_caregiver" },
    { "participantId": "syn-caregiver-elio", "actorRole": "caregiver" }
  ],
  "overlay": {
    "additionalParticipants": [],
    "institutionAdminAssignments": [],
    "additionalFamilyCareGrants": [],
    "preexistingCareItems": [
      {
        "itemId": "syn-gj2-item-daily",
        "enrollmentId": "syn-enrollment-c1-ia",
        "submittedByParticipantId": "syn-guardian-ada",
        "state": "acknowledged"
      }
    ]
  }
}
